{
  "taskId": "task-20260911-095555",
  "timestamp": "2026-09-11T02:02:20Z",
  "verifier": "repository verification workflow",
  "checks": {
    "compileCheck": {
      "passed": true,
      "command": ".\\mvnw.cmd -q compile"
    },
    "targetedTests": {
      "passed": true,
      "command": ".\\mvnw.cmd test -Dtest=ServerBehaviorTest,AuthorizationTest,GenreHandlerTest,MemberHandlerTest,CryptoTest,SecureTokenTest",
      "testsRan": 37,
      "testsFailed": 0
    },
    "fullGateTests": {
      "passed": true,
      "command": ".\\mvnw.cmd test",
      "testsRan": 100,
      "testsFailed": 0
    },
    "documentationIndex": {
      "passed": true,
      "command": ".\\scripts\\validate-doc-index.ps1"
    },
    "workflowIntegrity": {
      "passed": true,
      "command": ".\\scripts\\validate-ai-loop.ps1"
    },
    "docSync": {
      "passed": true,
      "docsUpdated": [
        "AGENTS.md",
        "docs/architecture.md",
        "docs/architecture-standards.md",
        "llms.txt"
      ]
    },
    "neutralityCheck": {
      "passed": true,
      "issuesFound": []
    },
    "noDuplication": {
      "passed": true,
      "analysis": "All production, test, Maven, and canonical-document references now use Server; generic REST API terminology remains unchanged."
    }
  },
  "overallResult": "passed",
  "issues": [],
  "artifacts": {
    "coverageReport": null,
    "testReport": null,
    "lintReport": null
  },
  "sign-off": {
    "signedBy": "repository verification workflow",
    "signedAt": "2026-09-11T02:02:20Z",
    "comments": "Fresh compile, targeted tests, full suite, documentation index, workflow contract, stale-reference search, and diff checks passed."
  },
  "rejection": {
    "rejectedBy": null,
    "rejectedAt": null,
    "reason": null,
    "requiresNewPlan": true
  }
}
