{
  "taskId": "task-20260910-174827",
  "timestamp": "2026-09-11T01:19:15Z",
  "verifier": "repository verification workflow",
  "checks": {
    "compileCheck": {
      "passed": true,
      "command": ".\\mvnw.cmd -q compile"
    },
    "targetedTests": {
      "passed": true,
      "command": ".\\mvnw.cmd -q test '-Dtest=APIBehaviorTest,AuthorizationTest,GenreHandlerTest,MemberHandlerTest,GenreHandlerTransactionTest,MemberHandlerTransactionTest,MemberServiceTest,XSRFFilterTest,PagedSearchTest,SecureTokenTest,XSRFTokenTest,RequestLoggerTest,ContextHelpersTest,TemplateEnginesTest,DGenreTest'; .\\mvnw.cmd test -Dtest=I18NTest",
      "testsRan": 69,
      "testsFailed": 0
    },
    "fullGateTests": {
      "passed": true,
      "command": ".\\mvnw.cmd test",
      "testsRan": 100,
      "testsFailed": 0
    },
    "documentationIndex": {
      "passed": true,
      "command": ".\\scripts\\validate-doc-index.ps1"
    },
    "workflowIntegrity": {
      "passed": true,
      "command": ".\\scripts\\validate-ai-loop.ps1"
    },
    "docSync": {
      "passed": true,
      "docsUpdated": [
        "AGENTS.md",
        "HARNESS.md",
        "LOOP.md",
        "README.md",
        "docs/architecture.md",
        "docs/architecture-standards.md",
        "docs/index.md",
        "llms.txt",
        "openapi.yaml"
      ]
    },
    "neutralityCheck": {
      "passed": true,
      "issuesFound": []
    },
    "noDuplication": {
      "passed": true,
      "analysis": "Consolidated token timestamp validation, pagination overload flow, route-role documentation, workflow gate definitions, and utility-type conventions; removed unused helpers and dependencies."
    }
  },
  "overallResult": "passed",
  "issues": [
    {
      "severity": "info",
      "description": "WSL could not start Bash validators (E_ACCESSDENIED); the equivalent PowerShell validators passed.",
      "file": "scripts/validate-doc-index.sh"
    }
  ],
  "artifacts": {
    "coverageReport": null,
    "testReport": null,
    "lintReport": null
  },
  "sign-off": {
    "signedBy": "repository verification workflow",
    "signedAt": "2026-09-11T01:19:15Z",
    "comments": "Compile, targeted tests, documentation/workflow validators, and the full Maven suite passed."
  }
}
