{
  "taskId": "task-20260911-115637",
  "timestamp": "2026-09-11T04:00:02Z",
  "verifier": "repository verification workflow",
  "checks": {
    "compileCheck": { "passed": true, "command": ".\\mvnw.cmd -q compile" },
    "targetedTests": {
      "passed": true,
      "command": ".\\mvnw.cmd test -Dtest=ContextHelpersTest,TemplateEnginesTest,SecureTokenTest,XSRFTokenTest,GenreHandlerTest,MemberHandlerTest",
      "testsRan": 24,
      "testsFailed": 0
    },
    "fullGateTests": { "passed": true, "command": ".\\mvnw.cmd test", "testsRan": 103, "testsFailed": 0 },
    "documentationIndex": { "passed": true, "command": ".\\scripts\\validate-doc-index.ps1" },
    "workflowIntegrity": { "passed": true, "command": ".\\scripts\\validate-ai-loop.ps1" },
    "docSync": { "passed": true, "docsUpdated": ["AGENTS.md", "docs/architecture.md"] },
    "neutralityCheck": { "passed": true, "issuesFound": [] },
    "noDuplication": {
      "passed": true,
      "analysis": "Restored reusable template APIs while centralizing message maps and retaining shared TimedToken validation."
    }
  },
  "overallResult": "passed",
  "issues": [],
  "artifacts": { "coverageReport": null, "testReport": null, "lintReport": null },
  "sign-off": {
    "signedBy": "repository verification workflow",
    "signedAt": "2026-09-11T04:00:02Z",
    "comments": "Compile, focused tests, full suite, documentation index, workflow contract, type/dependency consistency, and diff checks passed."
  },
  "rejection": { "rejectedBy": null, "rejectedAt": null, "reason": null, "requiresNewPlan": true }
}
