{
  "taskId": "task-20260909-090000",
  "timestamp": "2026-09-10T04:06:00Z",
  "verifier": "repository verification workflow",
  "checks": {
    "compileCheck": {
      "passed": true,
      "command": ".\\mvnw.cmd -q clean compile"
    },
    "targetedTests": {
      "passed": true,
      "command": ".\\mvnw.cmd test '-Dtest=GenreHandlerTransactionTest,MemberHandlerTransactionTest'",
      "testsRan": 14,
      "testsFailed": 0
    },
    "fullGateTests": {
      "passed": true,
      "command": ".\\mvnw.cmd test",
      "testsRan": 86,
      "testsFailed": 0
    },
    "documentationIndex": {
      "passed": true,
      "command": "not applicable before the documentation index validator was introduced"
    },
    "workflowIntegrity": {
      "passed": true,
      "command": ".\\scripts\\validate-ai-loop.ps1"
    },
    "docSync": {
      "passed": true,
      "docsUpdated": ["README.md", "docs/architecture.md"]
    },
    "neutralityCheck": {
      "passed": true,
      "issuesFound": []
    },
    "noDuplication": {
      "passed": true,
      "analysis": "Shared transaction lifecycle and annotation assertions live in HandlerTransactionTestSupport; feature persistence assertions remain in their feature tests. No dependencies or production behavior were added."
    }
  },
  "overallResult": "passed",
  "issues": [],
  "artifacts": {
    "coverageReport": null,
    "testReport": null,
    "lintReport": null
  },
  "sign-off": {
    "signedBy": "repository verification workflow",
    "signedAt": "2026-09-10T04:06:00Z",
    "comments": "Clean compile, targeted transaction tests, and full Maven test gate passed."
  }
}
